{
  "RunName": "xau_tick_validation_example",
  "Strategy": "ExampleStrategy",
  "ParameterFile": "BacktestEngine/examples/example.cbotset",
  "ParameterOverrides": {
    "HoldTicks": 100
  },
  "OutputRoot": "runs/validation",
  "RunBacktests": true,
  "Backtest": {
    "Project": "BacktestEngine/src/BacktestEngine.Run/BacktestEngine.Run.csproj",
    "Timeframe": "m5",
    "MaxTicks": 0
  },
  "Symbols": [
    {
      "Name": "XAUUSD",
      "TickFile": "data/XAUUSD/ticks.csv",
      "SymbolSpec": "data/XAUUSD/economic-symbol.v2.json"
    }
  ],
  "Windows": [
    {
      "Name": "june_2026",
      "StartUtc": "2026-06-01T00:00:00Z",
      "EndUtc": "2026-07-01T00:00:00Z"
    }
  ],
  "CostStress": {
    "SpreadMultipliers": [
      1.0,
      1.5,
      2.0
    ],
    "CommissionMultipliers": [
      1.0
    ],
    "BaseCommissionUsdPerMillion": 0.0
  },
  "LatencyStress": {
    "LatencyTicks": [
      1,
      5,
      10
    ]
  },
  "MonteCarlo": {
    "Runs": 1000,
    "Seed": 6363,
    "Balance": 10000.0,
    "SkipMin": 0.05,
    "SkipMax": 0.2,
    "SlippagePips": 2.0,
    "PnlNoiseFraction": 0.1
  },
  "WalkForward": {
    "StartUtc": "2026-01-01T00:00:00Z",
    "EndUtc": "2026-07-01T00:00:00Z",
    "TrainDays": 45,
    "ValidationDays": 15,
    "TestDays": 15,
    "EmbargoDays": 2
  },
  "Gates": {
    "MinTrades": 30,
    "MinProfitFactor": 1.15,
    "MaxDrawdownPct": 10.0,
    "MaxDailyDrawdownPct": 3.0,
    "MinSurvivability": 0.8
  },
  "ExistingReports": []
}
